Scheme Code,Fund Name,Fund Type,SD (Volatility %),Fund Age (yrs),1yr Return (%),3yr Return (%),5yr Return (%),Risk Score,Risk Category
138307,PGIM India Large Cap Fund - Dividend,Large Cap,14.64,10.34,-12.22,-1.68,-1.24,23.9,Moderate
105757,HDFC Mid Cap Fund - IDCW Plan,Mid Cap,16.68,19.01,-4.74,8.59,8.45,18.87,Low
148988,ICICI Prudential Flexicap Fund - IDCW,Flexi Cap,17.48,4.97,-2.64,9.18,10.89,32.64,High
101592,Aditya Birla Sun Life MIDCAP Fund-Growth,Mid Cap,15.6,20.27,4.68,17.7,15.24,15.74,Low
151035,HSBC Midcap Fund - Direct IDCW,Mid Cap,18.76,3.61,8.15,16.67,14.23,28.67,High
148354,ITI Large Cap Fund - Regular Plan - IDCW Option,Large Cap,15.89,5.53,-10.07,7.3,7.44,36.73,Very High
152003,LIC MF Small Cap Fund-Regular Plan-Growth,Small Cap,17.57,2.94,8.98,15.684999999999999,15.285,27.64,High
120726,UTI Mid Cap Fund-Growth Option- Direct,Mid Cap,15.15,13.52,0.78,14.44,13.81,23.85,Moderate
149668,Sundaram Multi Cap Fund (Formerly Known as Principal Multi Cap Growth Fund) - Direct Plan - Income Distribution CUM Capital Withdrawal Option (IDCW),Multi Cap,16.06,4.51,-6.42,7.34,13.01,37.67,Very High
144544,TATA Flexi Cap Fund Regular Plan - Payout of Income Distribution cum capital withdrawal option ,Flexi Cap,13.75,7.07,-9.12,10.13,9.26,35.92,Very High
130501,HDFC Small Cap Fund - IDCW Option,Small Cap,18.32,12.03,-12.59,1.97,4.46,29.52,High
105758,HDFC Mid Cap Fund - Growth Plan,Mid Cap,14.11,19.01,4.63,19.77,19.78,19.98,Low
152001,LIC MF Mid Cap Fund-Regular Plan-Growth,Mid Cap,16.13,2.94,2.65,15.905000000000001,14.23,33.84,Very High
140353,Edelweiss Flexi Cap Fund - Direct Plan - Growth Option,Flexi Cap,13.94,9.61,1.26,16.18,14.76,28.3,High
147841,Mahindra Manulife Large & Mid Cap Fund - Direct Plan - IDCW,Large & Mid Cap,16.45,6.52,-6.49,8.46,7.67,32.73,High
122639,Parag Parikh Flexi Cap Fund - Direct Plan - Growth,Flexi Cap,8.66,13.12,-2.6,14.58,14.4,25.9,Moderate
152095,Edelweiss Multi Cap Fund - Regular Plan - Growth,Multi Cap,14.62,2.69,1.74,15.17,13.01,33.47,Very High
152583,TRUSTMF Flexi Cap Fund-Regular Plan- IDCW,Flexi Cap,14.06,2.2,1.91,12.55,10.89,30.83,High
140810,Groww Largecap Fund (formerly known as Indiabulls Bluechip Fund)- Regular Plan- Monthly - Income Distribution cum capital withdrawal Option (Payout & Reinvestment),Large Cap,13.59,9.34,-1.76,10.38,10.15,25.91,Moderate
100630,quant Multi Cap Fund-IDCW Option - Regular Plan,Multi Cap,15.26,20.27,2.66,11.71,12.37,12.69,Low
140813,Groww Largecap Fund (formerly known as Indiabulls Bluechip Fund)- Regular Plan- Half Yearly - Income Distribution cum capital withdrawal Option (Payout & Reinvestment),Large Cap,13.58,9.35,-1.77,10.39,10.15,25.91,Moderate
129046,Motilal Oswal Flexi cap Fund Direct Plan-Growth Option,Flexi Cap,16.63,12.2,-5.59,19.22,12.73,35.84,Very High
146772,HSBC Large & Mid Cap Fund - Direct Growth,Large & Mid Cap,15.01,7.27,10.49,19.7,16.53,24.1,Moderate
148618,UTI Small Cap Fund - Direct Plan - Growth Option,Small Cap,16.03,5.54,3.2,17.23,16.9,32.74,High
118524,Franklin India Small Cap Fund - Direct - IDCW,Small Cap,19.14,13.52,-9.76,5.38,7.29,28.62,High
118883,Taurus Flexi Cap Fund - Direct Plan - Growth,Flexi Cap,14.24,13.52,-1.11,12.3,10.63,22.7,Moderate
151235,Tata Multicap Fund - Regular Plan - Growth,Multi Cap,14.66,3.41,6.81,11.85,13.01,25.11,Moderate
150819,Canara Robeco Mid Cap Fund- Regular Plan- IDCW,Mid Cap,16.7,3.59,-0.18,15.35,14.23,36.23,Very High
152351,Motilal Oswal Large Cap Direct Plan IDCW,Large Cap,13.87,2.41,-7.2,10.39,10.305,39.17,Very High
149019,PGIM India Small Cap Fund - Direct Plan- Growth Option,Small Cap,15.2,4.94,7.53,16.85,15.285,27.12,Moderate
148505,Sundaram Large Cap Fund (Formerly Known as Sundaram Blue Chip Fund)  Regular Plan - Payout of Income Distribution cum Capital Withdrawal (IDCW),Large Cap,14.85,5.74,-10.69,1.27,2.16,30.45,High
149669,Sundaram Multi Cap Fund (Formerly Known as Principal Multi Cap Growth Fund)-Direct Plan - Growth Option,Multi Cap,14.57,4.51,0.55,15.46,13.01,33.17,Very High
152739,Franklin India Multi Cap Fund - Direct - Growth,Multi Cap,15.33,1.95,4.24,15.17,13.01,31.71,High
150659,LIC MF Multi Cap Fund-Direct Plan-Growth,Multi Cap,15.36,3.69,8.15,20.17,13.01,30.49,High
118525,Franklin India Small Cap Fund - Direct - Growth,Small Cap,16.32,13.52,0.53,16.57,17.86,28.12,High
148619,UTI Small Cap Fund - Direct Plan - IDCW (Payout),Small Cap,16.03,5.54,3.2,17.23,16.9,32.74,High
152780,BAJAJ FINSERV LARGE CAP FUND - REGULAR PLAN - GROWTH,Large Cap,13.18,1.88,-1.6,10.39,10.305,33.1,Very High
102394,UTI Mid Cap Fund-Growth Option,Mid Cap,15.15,20.27,-0.06,13.43,12.77,16.91,Low
151033,HSBC Midcap Fund - Regular IDCW,Mid Cap,19.01,3.61,6.45,14.82,14.23,29.33,High
101209,Taurus Large Cap Fund - Regular Plan - Growth,Large Cap,12.47,20.27,-1.01,12.35,10.58,15.17,Low
120267,LIC MF Large Cap Fund-Direct Plan-Growth,Large Cap,13.87,13.52,-5.89,8.8,8.84,24.88,Moderate
120591,ICICI Prudential Smallcap Fund - Direct Plan - Growth,Small Cap,14.15,13.51,0.13,13.28,15.48,24.62,Moderate
125305,PGIM India Midcap Fund - Regular Plan - Growth Option,Mid Cap,15.45,12.59,-1.01,11.47,11.75,24.07,Moderate
102021,Baroda BNP Paribas MULTI CAP FUND - Regular Plan - IDCW Option,Multi Cap,14.85,20.27,-7.23,5.62,6.17,16.75,Low
143791,NAVI FLEXI CAP FUND - DIRECT PLAN QUARTERLY IDCW PAYOUT,Flexi Cap,15.34,8.0,8.66,13.33,13.43,19.69,Low
118777,Nippon India Small Cap Fund - Direct Plan Growth Plan - Bonus Option,Small Cap,15.24,13.51,4.07,18.45,20.33,26.21,Moderate
152650,Motilal Oswal Multi Cap Fund Regular Plan Growth,Multi Cap,17.56,2.05,-2.23,15.17,13.01,39.72,Very High
118872,Taurus Mid Cap Fund - Direct Plan - Growth,Mid Cap,16.53,13.52,-4.86,11.22,11.79,27.8,High
119582,Sundaram Mid Cap Fund Direct Plan - Income Distribution cum Capital Withdrawal (IDCW),Mid Cap,17.33,13.52,-0.07,13.65,12.28,24.41,Moderate
105989,DSP Small Cap Fund - Regular - Growth,Small Cap,16.23,19.06,8.99,18.66,17.84,14.16,Low
152096,Edelweiss Multi Cap Fund - Regular Plan - IDCW,Multi Cap,14.86,2.69,-1.54,15.17,13.01,37.24,Very High
119716,SBI MIDCAP FUND - DIRECT PLAN - GROWTH,Mid Cap,13.86,13.52,0.73,13.43,15.42,23.85,Moderate
127042,Motilal Oswal Midcap Fund-Direct Plan-Growth Option,Mid Cap,18.78,12.37,-5.55,19.44,22.95,41.75,Very High
148617,UTI Small Cap Fund - Regular Plan - Growth Option,Small Cap,16.03,5.54,1.98,15.77,15.2,32.34,High
119160,Tata Large Cap Fund -Direct Plan Growth Option,Large Cap,13.77,13.52,0.1,12.24,12.15,21.88,Low
118277,CANARA ROBECO LARGE AND MID CAP FUND - DIRECT PLAN - IDCW (Payout/Reinvestment),Large & Mid Cap,15.57,13.52,-6.81,8.47,7.16,25.5,Moderate
118534,Franklin India Flexi Cap Fund - Direct - IDCW ,Flexi Cap,15.15,13.52,-10.21,7.09,6.83,28.16,High
153909,Helios Small Cap Fund - Regular Plan - Growth Option,Small Cap,19.53,0.61,3.775,15.684999999999999,15.285,36.62,Very High
108403,Taurus Large Cap Fund - Regular Plan - Payout of Income Distribution cum Capital Withdrawal option,Large Cap,12.47,18.17,-1.01,12.35,10.57,17.26,Low
153738,CAPITALMIND FLEXI CAP FUND DIRECT GROWTH,Flexi Cap,11.82,0.93,-1.0350000000000001,12.55,10.89,34.51,Very High
111936,Edelweiss Large Cap Fund - Regular Plan - IDCW Option,Large Cap,14.41,17.14,-11.16,2.93,2.71,20.65,Low
100378,Nippon India Vision Large & Midcap Fund - IDCW Option,Mid Cap,56.21,20.27,-7.69,7.04,7.2,35.01,Very High
110604,BANK OF INDIA Large & Mid Cap Fund Eco Plan-Quarterly IDCW,Large & Mid Cap,13.29,17.69,4.42,15.54,13.32,15.38,Low
119619,Aditya Birla Sun Life Midcap Fund -DIRECT - IDCW,Mid Cap,16.91,13.52,-0.92,10.84,8.94,21.82,Low
119077,DSP Flexi Cap Fund - Direct Plan - IDCW,Flexi Cap,17.08,13.52,-8.41,4.65,2.36,23.17,Moderate
118423,BANDHAN Flexi Cap Fund-Direct Plan-IDCW,Flexi Cap,13.48,13.52,-6.24,5.49,5.21,21.2,Low
154227,Old Bridge Flexi Cap Fund Regular IDCW,Flexi Cap,12.32,0.35,-1.0350000000000001,12.55,10.89,35.29,Very High
148471,Baroda BNP Paribas Large and Mid Cap Fund-Regular Plan-Growth Option,Large & Mid Cap,14.52,5.83,-1.92,14.06,13.74,34.06,Very High
120843,quant Flexi Cap Fund - Growth Option-Direct Plan,Flexi Cap,16.41,13.5,8.99,18.39,16.55,19.03,Low
152071,WhiteOak Capital Multi Cap Fund Direct Plan Growth,Multi Cap,13.62,2.79,6.56,15.17,13.01,27.64,High
153610,BAJAJ FINSERV SMALL CAP FUND - REGULAR - IDCW,Small Cap,16.82,0.97,3.775,15.684999999999999,15.285,35.19,Very High
103360,Franklin India Small Cap Fund-Growth,Small Cap,16.32,20.27,-0.28,15.61,16.88,21.2,Low
125351,Axis Small Cap Fund - Direct Plan - IDCW,Small Cap,17.41,12.59,-4.14,7.39,7.5,23.68,Moderate
149450,Samco Flexi Cap Fund - Direct Plan - Growth Option,Flexi Cap,16.27,4.41,-9.91,-0.51,10.89,38.68,Very High
150442,quant Large Cap Fund - IDCW Option - Regular Plan,Large Cap,16.19,3.91,3.75,13.88,10.305,28.82,High
119556,Aditya Birla Sun Life Small Cap Fund - Growth - Direct Plan,Small Cap,16.56,13.5,9.4,17.66,13.95,17.44,Low
152308,DSP Multicap Fund - Regular - IDCW,Multi Cap,16.73,2.44,-8.0,15.17,13.01,45.49,Very High
154041,Abakkus Flexi Cap Fund - Regular - Growth,Flexi Cap,17.32,0.53,-1.0350000000000001,12.55,10.89,37.09,Very High
113222,CANARA ROBECO LARGE CAP FUND - REGULAR PLAN - IDCW (Payout/Reinvestment),Large Cap,14.3,15.88,-9.36,6.56,5.57,23.52,Moderate
119353,Baroda BNP Paribas MULTI CAP FUND - Direct Plan - IDCW Option,Multi Cap,14.85,13.5,-6.22,6.76,7.15,23.55,Moderate
150401,BANDHAN MIDCAP FUND - IDCW - DIRECT PLAN,Mid Cap,15.81,3.89,8.07,20.57,14.23,30.87,High
113177,Nippon India Small Cap Fund - Growth Plan - Growth Option,Small Cap,15.24,15.8,3.3,17.54,19.35,23.72,Moderate
149763,Invesco India Flexi Cap Fund - Direct Plan - Growth,Flexi Cap,16.05,4.39,1.78,19.94,10.89,36.0,Very High
145109,Axis Large & Mid Cap Fund - Direct Plan - IDCW,Large & Mid Cap,15.52,7.7,-2.52,7.65,7.09,25.91,Moderate
152135,Helios Flexi Cap Fund - Direct Plan - Growth Option,Flexi Cap,16.22,2.65,8.22,12.55,10.89,24.32,Moderate
101635,DSP Large Cap Fund - Regular Plan - Growth,Large Cap,12.33,20.27,-4.99,12.17,10.48,19.42,Low
151897,Bajaj Finserv Flexi Cap Fund-Regular Plan-IDCW,Flexi Cap,14.28,2.9,3.8,12.55,10.89,28.12,High
153238,Samco Large Cap Fund - Regular Plan - Growth Option,Large Cap,11.28,1.28,-11.77,10.39,10.305,44.43,Very High
152406,Bajaj Finserv Large and Mid Cap Fund- Regular Plan- Growth,Large & Mid Cap,14.32,2.36,-1.62,14.77,12.63,37.01,Very High
119018,HDFC Large Cap Fund - Growth Option - Direct Plan,Large Cap,13.57,13.52,-1.44,11.6,13.32,23.93,Moderate
141927,Axis Flexi Cap Fund - Regular Plan - Growth,Flexi Cap,14.14,8.62,0.92,12.55,9.73,25.13,Moderate
152006,LIC MF Small Cap Fund-Regular Plan-IDCW,Small Cap,17.57,2.94,8.98,15.684999999999999,15.285,27.64,High
151130,HSBC Small Cap Fund - Direct Growth,Small Cap,17.61,3.61,4.24,17.56,15.285,33.57,Very High
145206,Tata Small Cap Fund-Direct Plan-Growth,Small Cap,16.8,7.66,-6.61,12.91,16.17,39.37,Very High
150568,Sundaram Flexicap Fund Regular Growth,Flexi Cap,13.69,3.84,-4.09,9.75,10.89,34.16,Very High
142110,Mahindra Manulife Mid Cap Fund - Direct Plan -Growth,Mid Cap,16.09,8.42,8.88,23.08,19.68,28.73,High
120165,Kotak Flexicap Fund - Payout of Income Distribution cum capital withdrawal option- Direct,Flexi Cap,14.47,13.48,-1.28,13.97,12.74,25.11,Moderate
141247,Union Largecap Fund - Regular Plan - Growth Option,Large Cap,13.65,9.14,-3.98,8.56,9.11,27.03,Moderate
147917,ITI Small Cap Fund - Direct Plan - IDCW Option,Small Cap,17.25,6.39,11.12,24.26,16.47,29.64,High
154211,TRUSTMF MID CAP FUND -REGULAR-GROWTH,Mid Cap,14.29,0.3,2.55,15.905000000000001,14.23,35.85,Very High
119202,Tata Large & MId Cap Fund -Direct Plan- Growth Option,Large & Mid Cap,14.72,13.52,-6.19,9.3,11.82,27.67,High
151797,360 ONE FLEXICAP FUND-REGULAR PLAN- IDCW,Flexi Cap,15.37,3.01,2.94,16.25,10.89,32.45,High
119774,Kotak Midcap Fund  - Direct Plan - IDCW - Payout & Re-investment of Income Distribution cum capital withdrawal option,Mid Cap,15.86,13.47,7.09,21.24,18.48,23.77,Moderate
154307,JioBlackRock Large Cap Fund - Direct Plan - Growth Option,Large Cap,13.24,0.23,-3.15,10.39,10.305,36.52,Very High
151133,HSBC Small Cap Fund - Regular Growth,Small Cap,17.61,3.61,3.18,16.36,15.285,33.95,Very High
120030,HSBC Large Cap Fund - Direct Growth,Large Cap,14.09,13.52,-0.09,11.7,11.3,21.45,Low
119718,SBI Flexicap Fund - DIRECT PLAN - Growth Option,Flexi Cap,12.75,13.5,-2.2,9.49,9.89,21.27,Low
111935,Edelweiss Large Cap Fund -Plan B - Growth option,Large Cap,13.27,17.14,-3.67,9.77,10.62,20.09,Low
118479,BANDHAN Large Cap Fund-Direct Plan-Growth,Large Cap,13.67,13.52,1.06,13.69,13.12,22.14,Moderate
118533,Franklin India Mid Cap Fund - Direct - Growth,Mid Cap,15.12,13.52,-0.48,18.5,15.4,28.67,High
101530,SBI Large & Midcap Fund - Regular Plan - Income Distribution cum Capital Withdrawal Option (IDCW),Mid Cap,13.02,20.27,2.65,14.42,13.99,14.25,Low
118617,Edelweiss Large Cap Fund - Direct Plan-Growth option,Large Cap,13.27,13.5,-2.23,11.45,12.29,23.99,Moderate
130498,HDFC Large and Mid Cap Fund - Growth Option - Direct Plan,Large & Mid Cap,14.86,12.03,0.23,16.12,16.65,28.39,High
116548,Groww Largecap Fund (formerly known as Indiabulls Bluechip Fund)- Regular Plan- - Income Distribution cum capital withdrawal Option (Payout & Reinvestment),Large Cap,13.57,14.4,-1.76,10.39,10.15,20.85,Low
105504,Invesco India Midcap Fund - Regular Plan - IDCW (Payout / Reinvestment),Mid Cap,18.21,19.22,0.29,17.6,15.5,22.77,Moderate
101762,HDFC Flexi Cap Fund - Growth Plan,Flexi Cap,12.49,20.27,1.1,16.78,17.93,19.37,Low
141950,BANK OF INDIA Mid Cap Tax Fund Series 1 Direct Plan Growth,Mid Cap,16.48,8.37,4.57,15.77,13.07,25.87,Moderate
120380,ICICI Prudential MidCap Fund - Direct Plan -  IDCW,Mid Cap,18.48,13.5,5.75,17.2,11.88,21.32,Low
153533,Samco Large & Mid Cap Fund - Regular Plan - Growth Option,Large & Mid Cap,11.96,1.03,-12.42,14.77,12.63,49.54,Very High
151379,ITI Flexi Cap Fund- Direct Plan- Growth,Flexi Cap,14.96,3.38,8.22,20.36,10.89,31.29,High
133709,LIC MF Large & Mid Cap Fund-Direct Plan-IDCW,Large & Mid Cap,14.88,11.37,0.83,16.63,12.35,26.79,Moderate
150661,LIC MF Multi Cap Fund-Regular Plan-Growth,Multi Cap,15.36,3.69,6.57,18.3,13.01,30.15,High
100375,NIPPON INDIA GROWTH MID CAP FUND - IDCW Option,Mid Cap,72.46,20.27,-0.68,11.94,11.09,38.51,Very High
120403,Invesco India Midcap Fund - Direct Plan - Growth Option,Mid Cap,17.04,13.52,11.6,26.97,21.62,24.78,Moderate
151289,HSBC Multi Cap Fund - Regular - Growth,Multi Cap,15.05,3.43,4.83,19.72,13.01,33.39,Very High
118835,Mirae Asset Large & Midcap Fund - Direct Plan - IDCW,Mid Cap,16.07,13.52,-3.61,6.41,4.1,19.4,Low
116547,Groww Largecap Fund (formerly known as Indiabulls Blue Chip Fund) - Regular Plan- Growth Option,Large Cap,13.58,14.4,-1.78,10.38,10.15,20.87,Low
111939,Edelweiss Large Cap Fund - Plan C - IDCW Option,Large Cap,13.27,17.14,-3.67,9.77,10.62,20.09,Low
140812,Groww Largecap Fund (formerly known as Indiabulls Bluechip Fund)- Regular Plan- Quarterly - Income Distribution cum capital withdrawal Option (Payout & Reinvestment),Large Cap,13.63,9.34,-1.78,10.38,10.15,25.94,Moderate
118269,CANARA ROBECO LARGE CAP FUND - DIRECT PLAN - GROWTH OPTION,Large Cap,13.35,13.52,-3.53,11.52,11.34,24.95,Moderate
149302,BANDHAN MULTI CAP FUND - IDCW - REGULAR PLAN,Multi Cap,14.22,4.6,-6.32,8.5,13.01,37.08,Very High
140172,Edelweiss Large & Mid Cap Fund - Regular Plan - Growth Option,Large & Mid Cap,14.62,9.61,1.02,14.77,13.15,27.16,Moderate
149101,Mahindra Manulife Flexi Cap Fund - Regular Plan -Growth,Flexi Cap,13.37,4.87,-4.46,10.75,10.89,33.95,Very High
152130,Baroda BNP Paribas Small Cap Fund - Regular Plan - Growth option,Small Cap,15.03,2.69,3.22,15.684999999999999,15.285,33.39,Very High
150185,BARODA BNP PARIBAS LARGE CAP Fund- Regular Plan - Growth Option,Large Cap,12.79,4.32,-3.38,11.65,10.305,33.28,Very High
145137,Invesco India Smallcap Fund - Direct Plan - Growth,Small Cap,16.95,7.69,11.72,25.25,21.3,28.91,High
143793,Navi Flexi Cap Fund - Direct Plan - Growth,Flexi Cap,15.34,8.0,8.67,13.35,13.45,19.7,Low
152131,Baroda BNP Paribas Small Cap Fund - Regular Plan - IDCW option,Small Cap,15.03,2.69,3.22,15.684999999999999,15.285,33.39,Very High
150800,WhiteOak Capital Large Cap Fund Regular Plan IDCW,Large Cap,12.64,3.6,-1.39,12.88,10.305,32.55,High
147946,BANDHAN SMALL CAP FUND - DIRECT PLAN GROWTH,Small Cap,16.04,6.37,7.2,28.61,21.36,37.56,Very High
145677,BANK OF INDIA Small Cap Fund Regular Plan Growth,Small Cap,16.89,7.53,14.69,21.27,18.64,21.92,Low
153534,Samco Large & Mid Cap Fund - Direct Plan - Growth Option,Large & Mid Cap,11.93,1.03,-11.01,14.77,12.63,47.94,Very High
147944,BANDHAN SMALL CAP FUND - REGULAR PLAN GROWTH,Small Cap,16.04,6.37,5.91,26.9,19.61,37.1,Very High
100312,LIC MF Flexi Cap Fund-Regular Plan-IDCW,Flexi Cap,15.11,20.27,5.87,12.2,10.09,8.32,Low
102874,Kotak-Small Cap Fund - Payout of Income Distribution cum capital withdrawal option,Small Cap,15.43,20.27,-0.75,12.97,13.15,17.74,Low
151811,Mirae Asset Multicap Fund - Direct Plan - IDCW,Multi Cap,14.14,2.88,2.82,15.17,13.01,31.89,High
119588,Sundaram Small Cap Fund Direct Plan - Income Distribution cum Capital Withdrawal (IDCW),Small Cap,18.78,13.52,3.78,11.66,11.77,19.17,Low
150660,LIC MF Multi Cap Fund-Direct Plan-IDCW,Multi Cap,15.36,3.69,8.15,20.17,13.01,30.49,High
145110,Axis Large & Mid Cap Fund - Direct Plan - Growth,Large & Mid Cap,13.49,7.7,5.16,16.38,13.92,25.46,Moderate
152940,TRUSTMF SMALL CAP FUND -REGULAR PLAN-GROWTH,Small Cap,16.47,1.68,22.8,15.684999999999999,15.285,29.38,High
153239,Samco Large Cap Fund - Direct Plan - Growth Option,Large Cap,11.27,1.28,-10.33,10.39,10.305,42.8,Very High
153197,Mirae Asset Small Cap Fund - Direct Plan - IDCW,Small Cap,15.4,1.43,7.29,15.684999999999999,15.285,30.2,High
120662,UTI - Flexi Cap Fund-Growth Option - Direct,Flexi Cap,13.93,13.52,-4.17,8.78,6.69,21.89,Low
154104,Groww Small Cap Fund - Direct-IDCW,Small Cap,19.91,0.43,3.775,15.684999999999999,15.285,36.95,Very High
133712,LIC MF Large & Mid Cap Fund-Regular Plan-IDCW,Large & Mid Cap,14.88,11.37,-0.45,15.13,10.7,26.51,Moderate
120585,ICICI Prudential Large Cap Fund (erstwhile Bluechip Fund)  - Direct Plan - IDCW,Large Cap,13.38,13.52,-6.68,8.58,8.67,25.35,Moderate
103233,Kotak Large & Midcap Fund - IDCW-Regular,Mid Cap,15.04,20.27,1.19,14.98,14.23,17.16,Low
103504,SBI Large Cap FUND-REGULAR PLAN GROWTH,Large Cap,13.32,20.27,-1.16,9.91,11.02,14.48,Low
152408,Bajaj Finserv Large and Mid Cap Fund- Direct Plan- Growth,Large & Mid Cap,14.32,2.36,-0.23,14.77,12.63,35.45,Very High
154210,TRUSTMF MID CAP FUND -DIRECT -GROWTH,Mid Cap,14.33,0.3,2.55,15.905000000000001,14.23,35.87,Very High
150814,JM Midcap Fund (Direct) - IDCW,Mid Cap,17.35,3.62,8.63,23.08,14.23,33.77,Very High
119566,Sundaram Large and Midcap Fund Direct Plan - Growth,Mid Cap,15.45,13.51,5.77,15.7,14.5,19.5,Low
153873,THE WEALTH COMPANY FLEXI CAP FUND - DIRECT IDCW,Flexi Cap,16.36,0.73,-1.0350000000000001,12.55,10.89,36.51,Very High
107578,Mirae Asset Large Cap Fund - Growth Plan,Large Cap,13.73,18.25,-2.49,9.53,9.23,16.9,Low
103216,SBI Flexicap Fund - Regular Plan - Income Distribution cum Capital Withdrawal Option (IDCW),Flexi Cap,12.75,20.27,-3.0,8.58,8.94,14.37,Low
120185,ICICI Prudential US Bluechip Equity Fund - Direct Plan -  IDCW,Large Cap,15.07,13.51,17.8,14.32,11.54,14.88,Low
120664,UTI Large & Mid Cap Fund - Direct Plan - IDCW,Large & Mid Cap,13.45,13.52,2.08,18.05,16.08,25.13,Moderate
100795,Sundaram Small Cap Fund Regular Plan - Growth,Small Cap,16.97,20.27,9.84,18.7,17.08,11.98,Low
146127,CANARA ROBECO SMALL CAP FUND - REGULAR PLAN - GROWTH OPTION,Small Cap,15.7,7.39,1.03,13.73,15.88,30.8,High
108800,BANDHAN Large Cap Fund - Regular Plan - IDCW,Large Cap,14.26,18.1,-6.37,2.77,3.84,14.82,Low
153739,CAPITALMIND FLEXI CAP FUND REGULAR GROWTH,Flexi Cap,11.82,0.93,-1.0350000000000001,12.55,10.89,34.51,Very High
120823,quant Multi Cap Fund-GROWTH OPTION-Direct Plan,Multi Cap,15.26,13.5,3.81,12.95,13.82,19.68,Low
118424,BANDHAN Flexi Cap Fund-Direct Plan-Growth,Flexi Cap,12.77,13.52,0.05,13.17,12.09,22.07,Moderate
152823,ITI Large & Midcap Fund - Direct Plan - IDCW Option,Mid Cap,16.44,1.82,-0.0,15.905000000000001,14.23,38.05,Very High
118270,CANARA ROBECO LARGE CAP FUND - DIRECT PLAN - IDCW (Payout/Reinvestment),Large Cap,14.31,13.52,-8.31,7.84,8.09,26.82,Moderate
125354,Axis Small Cap Fund - Direct Plan - Growth,Small Cap,14.71,12.59,4.83,17.11,17.46,23.59,Moderate
111940,Edelweiss Large Cap Fund - Regular Plan - Growth Option,Large Cap,13.26,17.14,-3.67,9.77,10.6,20.08,Low
111938,Edelweiss Large Cap Fund - Plan B - IDCW Option,Large Cap,13.65,17.14,-7.13,8.44,9.81,22.97,Moderate
120045,HSBC Flexi Cap Fund - Direct IDCW,Flexi Cap,17.79,13.51,-7.0,10.16,8.02,28.11,High
119212,DSP Small Cap Fund - Direct Plan - Growth,Small Cap,16.22,13.52,9.98,19.72,18.89,19.76,Low
153871,THE WEALTH COMPANY FLEXI CAP FUND - REGULAR IDCW,Flexi Cap,16.39,0.73,-1.0350000000000001,12.55,10.89,36.52,Very High
143792,NAVI FLEXI CAP FUND - DIRECT PLAN NORMAL IDCW PAYOUT,Flexi Cap,15.34,8.0,8.65,13.33,13.4,19.68,Low
125497,SBI Small Cap Fund - Direct Plan - Growth,Small Cap,14.14,12.64,2.72,14.02,14.92,22.55,Moderate
119715,SBI Midcap Fund - Direct Plan - Income Distribution cum Capital Withdrawal Option (IDCW),Mid Cap,13.86,13.52,0.73,13.43,15.42,23.85,Moderate
145140,Invesco India Smallcap Fund - Regular Plan - IDCW (Payout / Reinvestment),Small Cap,18.54,7.69,-0.89,10.47,11.83,29.59,High
101706,ICICI Prudential Multicap Fund - IDCW,Multi Cap,17.99,20.27,-4.31,7.73,5.88,15.84,Low
100794,Sundaram Small Cap Fund Regular Plan - Income Distribution cum Capital Withdrawal (IDCW),Small Cap,18.8,20.27,2.63,10.43,10.52,12.34,Low
133836,PGIM India Flexi Cap Fund - Regular Plan - Growth Option,Flexi Cap,13.71,11.34,-1.31,9.42,8.73,22.12,Moderate
141224,Mahindra Manulife Multi Cap Fund - Regular Plan - Growth,Multi Cap,15.27,9.14,4.67,17.75,15.84,27.01,Moderate
152943,Helios Large & Mid Cap Fund - Regular Plan - Growth Option,Large & Mid Cap,16.0,1.68,6.02,14.77,12.63,29.85,High
152138,Helios Flexi Cap Fund - Direct Plan - IDCW Option,Flexi Cap,16.25,2.65,8.29,12.55,10.89,24.26,Moderate
120393,Invesco India Largecap Fund - Direct Plan - IDCW (Payout / Reinvestment),Large Cap,16.75,13.52,-6.85,5.39,6.14,23.67,Moderate
152094,Edelweiss Multi Cap Fund - Direct Plan - Growth,Multi Cap,14.62,2.69,3.24,15.17,13.01,31.8,High
118870,Taurus Large Cap Fund - Direct Plan - Growth,Large Cap,12.47,13.51,-0.81,12.52,10.72,21.87,Low
148475,Baroda BNP Paribas Large and Mid Cap Fund-Direct Plan-IDCW Option,Large & Mid Cap,18.04,5.83,-9.11,5.54,7.39,35.27,Very High
153327,Helios Mid Cap Fund - Regular Plan - Growth Plan,Mid Cap,16.68,1.31,13.57,15.905000000000001,14.23,23.92,Moderate
153543,Unifi Flexi Cap Fund - Direct Growth,Flexi Cap,13.56,1.08,2.33,12.55,10.89,31.28,High
103361,Franklin India Small Cap Fund - IDCW,Small Cap,18.98,20.27,-10.19,4.77,6.32,21.38,Low
110608,BANK OF INDIA Large & Mid Cap Fund Eco Plan-Regular IDCW,Large & Mid Cap,13.26,17.69,4.38,15.53,12.61,15.17,Low
150585,WhiteOak Capital Mid Cap Fund Regular Plan IDCW,Mid Cap,14.59,3.84,11.24,23.14,14.23,30.32,High
147478,Mirae Asset Midcap Fund Direct IDCW,Mid Cap,17.82,6.95,0.73,10.33,7.97,26.17,Moderate
152382,PGIM India Large and Midcap Fund - Direct Plan - Growth Option,Mid Cap,14.11,2.4,-0.31,15.905000000000001,14.23,36.9,Very High
134959,JM Large Cap Fund (Regular) - Monthly IDCW,Large Cap,14.16,11.03,-2.75,10.77,11.27,26.42,Moderate
119293,Union Flexi Cap Fund - Direct Plan - IDCW Option,Flexi Cap,15.89,13.52,-7.5,10.07,10.56,29.19,High
148407,BANK OF INDIA Flexi Cap Fund Regular Plan -IDCW,Flexi Cap,14.35,6.02,7.27,19.97,16.13,28.68,High
147749,Union Large & Midcap Fund - Regular Plan - IDCW Option,Mid Cap,14.83,6.57,1.86,12.97,12.38,27.81,High
140173,Edelweiss Large and Mid Cap Fund - Regular Plan - IDCW Option,Large & Mid Cap,14.62,9.61,1.02,14.77,10.98,26.35,Moderate
141928,Axis Flexi Cap Fund - Regular Plan - IDCW,Flexi Cap,14.55,8.62,-4.26,8.46,3.78,26.01,Moderate
119071,DSP Midcap Fund - Direct Plan - Growth,Mid Cap,15.54,13.52,3.81,18.65,13.09,23.59,Moderate
103165,Aditya Birla Sun Life Flexi Cap Fund -Regular - IDCW,Flexi Cap,14.76,20.27,-1.53,7.87,5.24,11.37,Low
154270,The Wealth Company Small Cap Fund- Direct-IDCW,Small Cap,14.03,0.28,3.775,15.684999999999999,15.285,34.77,Very High
149089,Nippon India Flexi Cap Fund - Regular Plan - Growth Plan - Growth Option,Flexi Cap,14.57,4.89,-0.83,12.13,10.89,31.14,High
111640,Taurus Flexi Cap Fund - Regular Plan - Payout of Income Distribution cum Capital Withdrawal option,Flexi Cap,14.24,17.52,-1.18,12.23,10.57,18.72,Low
129049,Motilal Oswal Flexi cap Fund Regular - IDCW Payout/Reinvestment,Flexi Cap,17.12,12.2,-12.92,10.08,4.04,34.19,Very High
130503,HDFC Small Cap Fund - Growth Option - Direct Plan,Small Cap,15.09,12.03,-2.43,13.65,16.51,30.2,High
151810,Mirae Asset Multicap Fund - Direct Plan - Growth,Multi Cap,14.15,2.88,2.83,15.17,13.01,31.88,High
153870,THE WEALTH COMPANY FLEXI CAP FUND - REGULAR GROWTH,Flexi Cap,16.39,0.73,-1.0350000000000001,12.55,10.89,36.52,Very High
145111,Axis Large & Mid Cap Fund - Regular Plan - IDCW,Large & Mid Cap,15.56,7.7,-3.58,6.47,2.87,24.7,Moderate
150347,WhiteOak Capital Flexi Cap Fund Regular Plan-Growth,Flexi Cap,13.13,3.93,1.69,15.53,10.89,31.32,High
152651,Motilal Oswal Multi Cap Fund-Direct Plan Growth,Multi Cap,17.56,2.05,-1.08,15.17,13.01,38.43,Very High
151131,HSBC Small Cap Fund - Regular IDCW,Small Cap,19.79,3.61,-6.1,6.3,15.285,41.5,Very High
120263,LIC MF Flexi Cap Fund-Direct Plan-IDCW,Flexi Cap,15.11,13.52,6.85,13.22,10.23,14.99,Low
105503,Invesco India Midcap Fund - Regular Plan - Growth Option,Mid Cap,17.04,19.22,10.3,25.43,20.06,18.83,Low
120870,ICICI Prudential Smallcap Fund - Direct Plan - IDCW,Small Cap,14.77,13.5,-4.38,8.17,10.02,23.96,Moderate
141223,Mahindra Manulife Multi Cap Fund - Direct Plan - IDCW,Multi Cap,16.3,9.14,0.83,14.52,11.26,27.58,High
